{
  "schema_version": "0.1",
  "file_id": "scan_018.pdf",
  "capabilities": {
    "block_kinds": true,
    "tables": true,
    "layout": false
  },
  "pages": [
    {
      "page": 1,
      "blocks": [
        {
          "id": "p1-b001",
          "kind": "heading",
          "text": "Transportes Guadaira S.A.",
          "rows": [],
          "uncertainties": []
        },
        {
          "id": "p1-b002",
          "kind": "paragraph",
          "text": "NIF: A41220987  ·  Sevilla",
          "rows": [],
          "uncertainties": []
        },
        {
          "id": "p1-b003",
          "kind": "paragraph",
          "text": "Cuenta de abono (IBAN): ES58 0075 1120 4400 8812 3345",
          "rows": [],
          "uncertainties": []
        },
        {
          "id": "p1-b004",
          "kind": "heading",
          "text": "FACTURA Nº FA-7788",
          "rows": [],
          "uncertainties": []
        },
        {
          "id": "p1-b005",
          "kind": "paragraph",
          "text": "Fecha: 19/06/2026",
          "rows": [],
          "uncertainties": []
        },
        {
          "id": "p1-b006",
          "kind": "paragraph",
          "text": "Pedido: PO-2026-0719",
          "rows": [],
          "uncertainties": []
        },
        {
          "id": "p1-b007",
          "kind": "paragraph",
          "text": "Cliente: Banco Miralmar S.A.  ·  CIF: A58231074",
          "rows": [],
          "uncertainties": []
        },
        {
          "id": "p1-b008",
          "kind": "table",
          "text": "",
          "rows": [
            {
              "id": "p1-b008-r01",
              "cells": [
                {
                  "id": "p1-b008-r01-c1",
                  "column": 1,
                  "row_span": 1,
                  "column_span": 1,
                  "text": "Servicio mensual"
                },
                {
                  "id": "p1-b008-r01-c2",
                  "column": 2,
                  "row_span": 1,
                  "column_span": 1,
                  "text": "826,67"
                }
              ]
            },
            {
              "id": "p1-b008-r02",
              "cells": [
                {
                  "id": "p1-b008-r02-c1",
                  "column": 1,
                  "row_span": 1,
                  "column_span": 1,
                  "text": "Mantenimiento trimestral"
                },
                {
                  "id": "p1-b008-r02-c2",
                  "column": 2,
                  "row_span": 1,
                  "column_span": 1,
                  "text": "826,67"
                }
              ]
            },
            {
              "id": "p1-b008-r03",
              "cells": [
                {
                  "id": "p1-b008-r03-c1",
                  "column": 1,
                  "row_span": 1,
                  "column_span": 1,
                  "text": "Suministro pedido"
                },
                {
                  "id": "p1-b008-r03-c2",
                  "column": 2,
                  "row_span": 1,
                  "column_span": 1,
                  "text": "826,66"
                }
              ]
            }
          ],
          "uncertainties": []
        },
        {
          "id": "p1-b011",
          "kind": "paragraph",
          "text": "Base imponible  2.480,00",
          "rows": [],
          "uncertainties": []
        },
        {
          "id": "p1-b012",
          "kind": "paragraph",
          "text": "IVA 21%  520,80",
          "rows": [],
          "uncertainties": []
        },
        {
          "id": "p1-b013",
          "kind": "paragraph",
          "text": "TOTAL 3.000,80 EUR",
          "rows": [],
          "uncertainties": []
        },
        {
          "id": "p1-b015",
          "kind": "stamp",
          "text": "RECIBIDO\nCONTABILIDAD",
          "rows": [],
          "uncertainties": []
        },
        {
          "id": "p1-b014",
          "kind": "footer",
          "text": "Documento generado por el sistema de facturacion del proveedor.",
          "rows": [],
          "uncertainties": []
        },
        {
          "id": "p1-b016",
          "kind": "other",
          "text": "Electricidad Montcada S.A.\nNIF: A46990201 · Valencia\nCuenta de abono (IBAN): ES35 2038 5778 9830 0076 5410\nFACTURA Nº F26-2203\nFecha: 07/06/2026\nPedido: PO-2026-0720\nCliente: Banco Miralmar S.A. · CIF: A58231074\nServicio mensual 1.040,00\nMantenimiento trimestral 1.040,00\nSuministro pedido 1.040,00\nBase imponible 3.120,00\nIVA 21% 655,20\nTOTAL 3.775,20 EUR\nURGENTE\nDocumento generado por el sistema de facturacion del proveedor.",
          "rows": [],
          "uncertainties": [
            {
              "kind": "uncertain",
              "raw_text": "Electricidad Montcada S.A.\nNIF: A46990201 · Valencia\nCuenta de abono (IBAN): ES35 2038 5778 9830 0076 5410\nFACTURA Nº F26-2203\nFecha: 07/06/2026\nPedido: PO-2026-0720\nCliente: Banco Miralmar S.A. · CIF: A58231074\nServicio mensual 1.040,00\nMantenimiento trimestral 1.040,00\nSuministro pedido 1.040,00\nBase imponible 3.120,00\nIVA 21% 655,20\nTOTAL 3.775,20 EUR\nURGENTE\nDocumento generado por el sistema de facturacion del proveedor.",
              "description": "Faint mirrored bleed-through; tentative partial transcription, unreadable regions remain."
            }
          ]
        }
      ],
      "non_text_elements": [
        {
          "description": "Oval double-border RECIBIDO CONTABILIDAD stamp. Faint horizontally mirrored second document on right with diagonal rectangular URGENTE stamp and second footer; uncertain mirrored transcription is isolated from foreground invoice.",
          "reference_ids": []
        }
      ]
    }
  ]
}
