{
  "schema_version": "0.1",
  "file_id": "scan_026.pdf",
  "capabilities": {
    "block_kinds": true,
    "tables": true,
    "layout": false
  },
  "pages": [
    {
      "page": 1,
      "blocks": [
        {
          "id": "p1-b001",
          "kind": "heading",
          "text": "Seguridad Alcores S.L.",
          "rows": [],
          "uncertainties": []
        },
        {
          "id": "p1-b002",
          "kind": "paragraph",
          "text": "NIF: B91455230  ·  Sevilla",
          "rows": [],
          "uncertainties": []
        },
        {
          "id": "p1-b003",
          "kind": "paragraph",
          "text": "Cuenta de abono (IBAN): ES09 0073 0100 5105 0533 1902",
          "rows": [],
          "uncertainties": []
        },
        {
          "id": "p1-b004",
          "kind": "heading",
          "text": "FACTURA Nº F26-7712",
          "rows": [],
          "uncertainties": []
        },
        {
          "id": "p1-b005",
          "kind": "paragraph",
          "text": "Fecha: 15/05/2026",
          "rows": [],
          "uncertainties": []
        },
        {
          "id": "p1-b006",
          "kind": "paragraph",
          "text": "Pedido: PO-2026-0729",
          "rows": [],
          "uncertainties": []
        },
        {
          "id": "p1-b007",
          "kind": "paragraph",
          "text": "Cliente: Banco Miralmar S.A.  ·  CIF: A58231074",
          "rows": [],
          "uncertainties": []
        },
        {
          "id": "p1-b008",
          "kind": "table",
          "text": "",
          "rows": [
            {
              "id": "p1-b008-r01",
              "cells": [
                {
                  "id": "p1-b008-r01-c1",
                  "column": 1,
                  "row_span": 1,
                  "column_span": 1,
                  "text": "Servicio mensual"
                },
                {
                  "id": "p1-b008-r01-c2",
                  "column": 2,
                  "row_span": 1,
                  "column_span": 1,
                  "text": "826,67"
                }
              ]
            },
            {
              "id": "p1-b008-r02",
              "cells": [
                {
                  "id": "p1-b008-r02-c1",
                  "column": 1,
                  "row_span": 1,
                  "column_span": 1,
                  "text": "Mantenimiento trimestral"
                },
                {
                  "id": "p1-b008-r02-c2",
                  "column": 2,
                  "row_span": 1,
                  "column_span": 1,
                  "text": "826,67"
                }
              ]
            },
            {
              "id": "p1-b008-r03",
              "cells": [
                {
                  "id": "p1-b008-r03-c1",
                  "column": 1,
                  "row_span": 1,
                  "column_span": 1,
                  "text": "Suministro pedido"
                },
                {
                  "id": "p1-b008-r03-c2",
                  "column": 2,
                  "row_span": 1,
                  "column_span": 1,
                  "text": "826,66"
                }
              ]
            }
          ],
          "uncertainties": []
        },
        {
          "id": "p1-b011",
          "kind": "paragraph",
          "text": "Base imponible  2.480,00",
          "rows": [],
          "uncertainties": []
        },
        {
          "id": "p1-b012",
          "kind": "paragraph",
          "text": "IVA 21%  520,80",
          "rows": [],
          "uncertainties": []
        },
        {
          "id": "p1-b013",
          "kind": "paragraph",
          "text": "TOTAL 3.000,80 EUR",
          "rows": [],
          "uncertainties": []
        },
        {
          "id": "p1-b014",
          "kind": "footer",
          "text": "Documento generado por el sistema de facturacion del proveedor.",
          "rows": [],
          "uncertainties": []
        }
      ],
      "non_text_elements": [
        {
          "description": "Fine vertical scan stripes across page; two dark oval marks upper left.",
          "reference_ids": []
        }
      ]
    }
  ]
}
