{
  "schema_version": "0.1",
  "file_id": "FA-4385_informática.pdf",
  "capabilities": {
    "block_kinds": true,
    "tables": true,
    "layout": false
  },
  "pages": [
    {
      "page": 1,
      "blocks": [
        {
          "id": "p1-b001",
          "kind": "heading",
          "text": "INFORMÁTICA BENIMÁMET S.L.",
          "rows": [],
          "uncertainties": []
        },
        {
          "id": "p1-b002",
          "kind": "paragraph",
          "text": "NIF: B98455101   |  Valencia",
          "rows": [],
          "uncertainties": []
        },
        {
          "id": "p1-b003",
          "kind": "paragraph",
          "text": "IBAN: ES27 0239 0806 6671 2233 4455",
          "rows": [],
          "uncertainties": []
        },
        {
          "id": "p1-b004",
          "kind": "heading",
          "text": "Invoice # FA-4385",
          "rows": [],
          "uncertainties": []
        },
        {
          "id": "p1-b005",
          "kind": "paragraph",
          "text": "Fecha factura: 21/06/2026  PO: PO-2026-0091",
          "rows": [],
          "uncertainties": []
        },
        {
          "id": "p1-b006",
          "kind": "paragraph",
          "text": "Bill to: Banco Miralmar S.A. (CIF: A58231074)",
          "rows": [],
          "uncertainties": []
        },
        {
          "id": "p1-b007",
          "kind": "paragraph",
          "text": "- Cuota de servicio (1 ud): EUR 2.08",
          "rows": [],
          "uncertainties": []
        },
        {
          "id": "p1-b008",
          "kind": "paragraph",
          "text": "- Instalación (1 ud): EUR 101.96",
          "rows": [],
          "uncertainties": []
        },
        {
          "id": "p1-b009",
          "kind": "paragraph",
          "text": "Subtotal: EUR 104.04",
          "rows": [],
          "uncertainties": []
        },
        {
          "id": "p1-b010",
          "kind": "paragraph",
          "text": "IVA (21%): EUR 21.85",
          "rows": [],
          "uncertainties": []
        },
        {
          "id": "p1-b011",
          "kind": "paragraph",
          "text": "TOTAL A PAGAR: EUR 125.89",
          "rows": [],
          "uncertainties": []
        },
        {
          "id": "p1-b012",
          "kind": "footer",
          "text": "Documento generado por el sistema de facturacion del proveedor.",
          "rows": [],
          "uncertainties": []
        }
      ],
      "non_text_elements": []
    }
  ]
}
