{
  "capabilities": {
    "block_kinds": true,
    "layout": false,
    "tables": false
  },
  "file_id": "scan_023.pdf",
  "pages": [
    {
      "blocks": [
        {
          "id": "p1-fg-b1",
          "kind": "heading",
          "rows": [],
          "text": "Catering Hermanos Pico S.L.",
          "uncertainties": []
        },
        {
          "id": "p1-fg-b2",
          "kind": "paragraph",
          "rows": [],
          "text": "NIF: B96233419 Valencia",
          "uncertainties": []
        },
        {
          "id": "p1-fg-b3",
          "kind": "stamp",
          "rows": [],
          "text": "OK A",
          "uncertainties": []
        },
        {
          "id": "p1-fg-b4",
          "kind": "paragraph",
          "rows": [],
          "text": "Cuenta de abono (IBAN): ES18 0081 5290 0700 0123 4567",
          "uncertainties": []
        },
        {
          "id": "p1-fg-b5",
          "kind": "heading",
          "rows": [],
          "text": "FACTURA Nº 2026/22608",
          "uncertainties": []
        },
        {
          "id": "p1-fg-b6",
          "kind": "paragraph",
          "rows": [],
          "text": "Fecha: 29/04/2026",
          "uncertainties": []
        },
        {
          "id": "p1-fg-b7",
          "kind": "paragraph",
          "rows": [],
          "text": "Pedido: PO-2026-0726",
          "uncertainties": []
        },
        {
          "id": "p1-fg-b8",
          "kind": "paragraph",
          "rows": [],
          "text": "Cliente: Banco Miralmar S.A. - CIF: A58231074",
          "uncertainties": []
        },
        {
          "id": "p1-fg-b9",
          "kind": "paragraph",
          "rows": [],
          "text": "Servicio mensual 683,33",
          "uncertainties": []
        },
        {
          "id": "p1-fg-b10",
          "kind": "paragraph",
          "rows": [],
          "text": "Mantenimiento trimestral 683,33",
          "uncertainties": []
        },
        {
          "id": "p1-fg-b11",
          "kind": "paragraph",
          "rows": [],
          "text": "Suministro pedido 683,34",
          "uncertainties": []
        },
        {
          "id": "p1-fg-b12",
          "kind": "paragraph",
          "rows": [],
          "text": "Base imponible 2.050,00",
          "uncertainties": []
        },
        {
          "id": "p1-fg-b13",
          "kind": "paragraph",
          "rows": [],
          "text": "IVA 21% 430,50",
          "uncertainties": []
        },
        {
          "id": "p1-fg-b14",
          "kind": "paragraph",
          "rows": [],
          "text": "TOTAL 2.480,50 EUR",
          "uncertainties": []
        },
        {
          "id": "p1-fg-b15",
          "kind": "footer",
          "rows": [],
          "text": "Documento generado por el sistema de facturación del proveedor",
          "uncertainties": [
            {
              "description": "Text is extremely faint and low contrast, making it difficult to read with certainty.",
              "kind": "uncertain",
              "raw_text": "Documento generado por el sistema de facturación del proveedor"
            }
          ]
        },
        {
          "id": "p1-bg-b1",
          "kind": "heading",
          "rows": [],
          "text": "Informática Benimámet S.L.",
          "uncertainties": []
        },
        {
          "id": "p1-bg-b2",
          "kind": "paragraph",
          "rows": [],
          "text": "CIF: [unreadable]",
          "uncertainties": [
            {
              "description": "The CIF line is present but the characters are too faint and low-contrast to read in the provided views.",
              "kind": "uncertain",
              "raw_text": "CIF: [unreadable]"
            }
          ]
        },
        {
          "id": "p1-bg-b3",
          "kind": "paragraph",
          "rows": [],
          "text": "Calle de la Paz, 11, 46122 Benimámet (Valencia)",
          "uncertainties": [
            {
              "description": "The address line is present but illegible due to low contrast. The text is inferred from draft_a as it is the only readable candidate, but visual confirmation is weak.",
              "kind": "uncertain",
              "raw_text": "Calle de la Paz, 11, 46122 Benimámet (Valencia)"
            }
          ]
        },
        {
          "id": "p1-bg-b4",
          "kind": "heading",
          "rows": [],
          "text": "FACTURA Nº PA-4511",
          "uncertainties": []
        },
        {
          "id": "p1-bg-b5",
          "kind": "paragraph",
          "rows": [],
          "text": "Fecha: 12/07/2020",
          "uncertainties": [
            {
              "description": "The date is present but the characters are faint. The specific date is inferred from draft_a as it is the only readable candidate.",
              "kind": "uncertain",
              "raw_text": "Fecha: 12/07/2020"
            }
          ]
        },
        {
          "id": "p1-bg-b6",
          "kind": "paragraph",
          "rows": [],
          "text": "Fecha, FC-0228/0125 :",
          "uncertainties": [
            {
              "description": "The line is present but illegible. The text is inferred from draft_a as it is the only readable candidate.",
              "kind": "uncertain",
              "raw_text": "Fecha, FC-0228/0125 :"
            }
          ]
        },
        {
          "id": "p1-bg-b7",
          "kind": "paragraph",
          "rows": [],
          "text": "Cliente: Banco Santander S.A. [unreadable]",
          "uncertainties": [
            {
              "description": "The client line is present but the text is too faint to read. The content is inferred from draft_a.",
              "kind": "uncertain",
              "raw_text": "Cliente: Banco Santander S.A. [unreadable]"
            }
          ]
        },
        {
          "id": "p1-bg-b8",
          "kind": "paragraph",
          "rows": [],
          "text": "Base imponible 1.000,00",
          "uncertainties": [
            {
              "description": "The line is present but the text is faint. The value is inferred from draft_a.",
              "kind": "uncertain",
              "raw_text": "Base imponible 1.000,00"
            }
          ]
        },
        {
          "id": "p1-bg-b9",
          "kind": "paragraph",
          "rows": [],
          "text": "Subtotal imponible 1.000,00",
          "uncertainties": [
            {
              "description": "The line is present but the text is faint. The value is inferred from draft_a.",
              "kind": "uncertain",
              "raw_text": "Subtotal imponible 1.000,00"
            }
          ]
        },
        {
          "id": "p1-bg-b10",
          "kind": "paragraph",
          "rows": [],
          "text": "IVA 21% 210,00",
          "uncertainties": [
            {
              "description": "The tax line is present but the text is faint. The value is inferred from draft_a.",
              "kind": "uncertain",
              "raw_text": "IVA 21% 210,00"
            }
          ]
        },
        {
          "id": "p1-bg-b11",
          "kind": "paragraph",
          "rows": [],
          "text": "TOTAL 1.374,00 EUR",
          "uncertainties": []
        }
      ],
      "non_text_elements": [
        {
          "description": "Prominent bleed-through of reversed text from the reverse side of the page visible on the right half.",
          "reference_ids": []
        },
        {
          "description": "Dark grey smudges obscuring the NIF number, the IBAN account number, and the final TOTAL amount.",
          "reference_ids": []
        },
        {
          "description": "Document appears to be a scanned invoice with standard layout.",
          "reference_ids": []
        },
        {
          "description": "The NIF, Valencia, and IBAN lines are partially obscured by a grey smudge.",
          "reference_ids": []
        },
        {
          "description": "The total amount '2.480,50 EUR' is highlighted with a grey smudge.",
          "reference_ids": []
        },
        {
          "description": "The footer text is very faint.",
          "reference_ids": []
        },
        {
          "description": "The document is a Spanish invoice. The text is very faint and low-contrast, making some characters difficult to read with absolute certainty. The footer is illegible.",
          "reference_ids": []
        }
      ],
      "page": 1
    }
  ],
  "schema_version": "0.1"
}
