{
  "schema_version": "0.1",
  "file_id": "2026-01-11_P007.pdf",
  "capabilities": {
    "block_kinds": true,
    "tables": true,
    "layout": false
  },
  "pages": [
    {
      "page": 1,
      "blocks": [
        {
          "id": "p1-b001",
          "kind": "heading",
          "text": "FACTURA",
          "rows": [],
          "uncertainties": []
        },
        {
          "id": "p1-b002",
          "kind": "paragraph",
          "text": "Factura: FA-3566  Fecha: 11/01/2026",
          "rows": [],
          "uncertainties": []
        },
        {
          "id": "p1-b003",
          "kind": "paragraph",
          "text": "Pedido: PO-2026-0167",
          "rows": [],
          "uncertainties": []
        },
        {
          "id": "p1-b004",
          "kind": "paragraph",
          "text": "Papelería Ruzafa S.C.",
          "rows": [],
          "uncertainties": []
        },
        {
          "id": "p1-b005",
          "kind": "paragraph",
          "text": "NIF: J40112358",
          "rows": [],
          "uncertainties": []
        },
        {
          "id": "p1-b006",
          "kind": "paragraph",
          "text": "IBAN: ES55 3159 0012 3487 6512 3407",
          "rows": [],
          "uncertainties": []
        },
        {
          "id": "p1-b007",
          "kind": "paragraph",
          "text": "Cliente: Banco Miralmar S.A. · CIF: A58231074",
          "rows": [],
          "uncertainties": []
        },
        {
          "id": "p1-b008",
          "kind": "paragraph",
          "text": "Cuota de servicio ....... 328,73",
          "rows": [],
          "uncertainties": []
        },
        {
          "id": "p1-b009",
          "kind": "paragraph",
          "text": "Suministro pedido ....... 2.103,87",
          "rows": [],
          "uncertainties": []
        },
        {
          "id": "p1-b010",
          "kind": "paragraph",
          "text": "Consumibles ....... 4.141,99",
          "rows": [],
          "uncertainties": []
        },
        {
          "id": "p1-b011",
          "kind": "paragraph",
          "text": "Base: 6.574,59",
          "rows": [],
          "uncertainties": []
        },
        {
          "id": "p1-b012",
          "kind": "paragraph",
          "text": "IVA (21%): 1.380,66",
          "rows": [],
          "uncertainties": []
        },
        {
          "id": "p1-b013",
          "kind": "paragraph",
          "text": "TOTAL: 7.955,25",
          "rows": [],
          "uncertainties": []
        },
        {
          "id": "p1-b014",
          "kind": "footer",
          "text": "Documento generado por el sistema de facturacion del proveedor.",
          "rows": [],
          "uncertainties": []
        }
      ],
      "non_text_elements": []
    }
  ]
}
