{
  "schema_version": "0.1",
  "file_id": "2026-01-18_P005.pdf",
  "capabilities": {
    "block_kinds": true,
    "tables": true,
    "layout": false
  },
  "pages": [
    {
      "page": 1,
      "blocks": [
        {
          "id": "p1-b001",
          "kind": "heading",
          "text": "FACTURA",
          "rows": [],
          "uncertainties": []
        },
        {
          "id": "p1-b002",
          "kind": "paragraph",
          "text": "Factura: FA-2247  Fecha: 18/01/2026",
          "rows": [],
          "uncertainties": []
        },
        {
          "id": "p1-b003",
          "kind": "paragraph",
          "text": "Pedido: PO-2026-0161",
          "rows": [],
          "uncertainties": []
        },
        {
          "id": "p1-b004",
          "kind": "paragraph",
          "text": "Catering Hermanos Pico S.L.",
          "rows": [],
          "uncertainties": []
        },
        {
          "id": "p1-b005",
          "kind": "paragraph",
          "text": "NIF: B96233419",
          "rows": [],
          "uncertainties": []
        },
        {
          "id": "p1-b006",
          "kind": "paragraph",
          "text": "IBAN: ES18 0081 5290 0700 0123 4567",
          "rows": [],
          "uncertainties": []
        },
        {
          "id": "p1-b007",
          "kind": "paragraph",
          "text": "Cliente: Banco Miralmar S.A. · CIF: A58231074",
          "rows": [],
          "uncertainties": []
        },
        {
          "id": "p1-b008",
          "kind": "paragraph",
          "text": "Consumibles ....... 1.144,70",
          "rows": [],
          "uncertainties": []
        },
        {
          "id": "p1-b009",
          "kind": "paragraph",
          "text": "Transporte urgente ....... 1.191,42",
          "rows": [],
          "uncertainties": []
        },
        {
          "id": "p1-b010",
          "kind": "paragraph",
          "text": "Base: 2.336,12",
          "rows": [],
          "uncertainties": []
        },
        {
          "id": "p1-b011",
          "kind": "paragraph",
          "text": "IVA (21%): 490,59",
          "rows": [],
          "uncertainties": []
        },
        {
          "id": "p1-b012",
          "kind": "paragraph",
          "text": "TOTAL: 2.826,71",
          "rows": [],
          "uncertainties": []
        },
        {
          "id": "p1-b013",
          "kind": "footer",
          "text": "Documento generado por el sistema de facturacion del proveedor.",
          "rows": [],
          "uncertainties": []
        }
      ],
      "non_text_elements": []
    }
  ]
}
