{
  "schema_version": "0.1",
  "file_id": "scan_014.pdf",
  "capabilities": {
    "block_kinds": true,
    "tables": true,
    "layout": false
  },
  "pages": [
    {
      "page": 1,
      "blocks": [
        {
          "id": "p1-b001",
          "kind": "heading",
          "text": "Mensajer�a R�pida del Sur S.L.",
          "rows": [],
          "uncertainties": [
            {
              "kind": "uncertain",
              "raw_text": "Mensajer�a R�pida del Sur S.L.",
              "description": "Damaged accented glyphs; replacement symbol denotes unreadable glyph, not literal text."
            }
          ]
        },
        {
          "id": "p1-b002",
          "kind": "paragraph",
          "text": "NIF: B90233808  IBAN: ES93 6888 4400 1235 8890 0142",
          "rows": [],
          "uncertainties": []
        },
        {
          "id": "p1-b003",
          "kind": "paragraph",
          "text": "Factura FA-6328  Fecha 03/05/2026",
          "rows": [],
          "uncertainties": []
        },
        {
          "id": "p1-b004",
          "kind": "paragraph",
          "text": "Pedido PO-2026-0490",
          "rows": [],
          "uncertainties": []
        },
        {
          "id": "p1-b005",
          "kind": "paragraph",
          "text": "Cliente: Banco Miralmar S.A.  CIF A58231074",
          "rows": [],
          "uncertainties": []
        },
        {
          "id": "p1-b006",
          "kind": "paragraph",
          "text": "Reparaci�n equipo  590,06",
          "rows": [],
          "uncertainties": [
            {
              "kind": "uncertain",
              "raw_text": "Reparaci�n equipo  590,06",
              "description": "Damaged accented glyph; replacement symbol denotes unreadable glyph."
            }
          ]
        },
        {
          "id": "p1-b007",
          "kind": "paragraph",
          "text": "Mantenimiento trimestral  699,33",
          "rows": [],
          "uncertainties": []
        },
        {
          "id": "p1-b008",
          "kind": "paragraph",
          "text": "Servicio de limpieza  896,03",
          "rows": [],
          "uncertainties": []
        },
        {
          "id": "p1-b009",
          "kind": "paragraph",
          "text": "Base 2.185,42  IVA 21% 458,94",
          "rows": [],
          "uncertainties": []
        },
        {
          "id": "p1-b010",
          "kind": "paragraph",
          "text": "TOTAL 2.644,36 EUR",
          "rows": [],
          "uncertainties": []
        }
      ],
      "non_text_elements": [
        {
          "description": "Small skewed raster text on an otherwise blank page; some accented glyphs damaged.",
          "reference_ids": []
        }
      ]
    }
  ]
}
