{
  "schema_version": "0.1",
  "file_id": "2026-01-12_P002.pdf",
  "capabilities": {
    "block_kinds": true,
    "tables": true,
    "layout": false
  },
  "pages": [
    {
      "page": 1,
      "blocks": [
        {
          "id": "p1-b001",
          "kind": "heading",
          "text": "FACTURA",
          "rows": [],
          "uncertainties": []
        },
        {
          "id": "p1-b002",
          "kind": "paragraph",
          "text": "Factura: FA-6827  Fecha: 12/01/2026",
          "rows": [],
          "uncertainties": []
        },
        {
          "id": "p1-b003",
          "kind": "paragraph",
          "text": "Pedido: PO-2026-0061",
          "rows": [],
          "uncertainties": []
        },
        {
          "id": "p1-b004",
          "kind": "paragraph",
          "text": "Transportes Guadaira S.A.",
          "rows": [],
          "uncertainties": []
        },
        {
          "id": "p1-b005",
          "kind": "paragraph",
          "text": "NIF: A41220987",
          "rows": [],
          "uncertainties": []
        },
        {
          "id": "p1-b006",
          "kind": "paragraph",
          "text": "IBAN: ES76 2100 0813 6101 2345 6789",
          "rows": [],
          "uncertainties": []
        },
        {
          "id": "p1-b007",
          "kind": "paragraph",
          "text": "Cliente: Banco Miralmar S.A. · CIF: A58231074",
          "rows": [],
          "uncertainties": []
        },
        {
          "id": "p1-b008",
          "kind": "paragraph",
          "text": "Mantenimiento trimestral ....... 198,87",
          "rows": [],
          "uncertainties": []
        },
        {
          "id": "p1-b009",
          "kind": "paragraph",
          "text": "Material de oficina ....... 106,54",
          "rows": [],
          "uncertainties": []
        },
        {
          "id": "p1-b010",
          "kind": "paragraph",
          "text": "Material de oficina ....... 404,84",
          "rows": [],
          "uncertainties": []
        },
        {
          "id": "p1-b011",
          "kind": "paragraph",
          "text": "Base: 710,25",
          "rows": [],
          "uncertainties": []
        },
        {
          "id": "p1-b012",
          "kind": "paragraph",
          "text": "IVA (21%): 149,15",
          "rows": [],
          "uncertainties": []
        },
        {
          "id": "p1-b013",
          "kind": "paragraph",
          "text": "TOTAL: 859,40",
          "rows": [],
          "uncertainties": []
        },
        {
          "id": "p1-b014",
          "kind": "footer",
          "text": "Documento generado por el sistema de facturacion del proveedor.",
          "rows": [],
          "uncertainties": []
        }
      ],
      "non_text_elements": []
    }
  ]
}
