{
  "schema_version": "0.1",
  "file_id": "FA-5197_papelería.pdf",
  "capabilities": {
    "block_kinds": true,
    "tables": true,
    "layout": false
  },
  "pages": [
    {
      "page": 1,
      "blocks": [
        {
          "id": "p1-b001",
          "kind": "heading",
          "text": "Papelería Ruzafa S.C.",
          "rows": [],
          "uncertainties": []
        },
        {
          "id": "p1-b002",
          "kind": "paragraph",
          "text": "NIF: J40112358",
          "rows": [],
          "uncertainties": []
        },
        {
          "id": "p1-b003",
          "kind": "paragraph",
          "text": "Valencia · España",
          "rows": [],
          "uncertainties": []
        },
        {
          "id": "p1-b004",
          "kind": "paragraph",
          "text": "IBAN: ES55 3159 0012 3487 6512 3407",
          "rows": [],
          "uncertainties": []
        },
        {
          "id": "p1-b005",
          "kind": "heading",
          "text": "FACTURA Nº: FA-5197",
          "rows": [],
          "uncertainties": []
        },
        {
          "id": "p1-b006",
          "kind": "paragraph",
          "text": "Fecha: 01/02/2026",
          "rows": [],
          "uncertainties": []
        },
        {
          "id": "p1-b007",
          "kind": "paragraph",
          "text": "Ref. Pedido: PO-2026-0286",
          "rows": [],
          "uncertainties": []
        },
        {
          "id": "p1-b008",
          "kind": "paragraph",
          "text": "Cliente: Banco Miralmar S.A.  · CIF: A58231074",
          "rows": [],
          "uncertainties": []
        },
        {
          "id": "p1-b009",
          "kind": "paragraph",
          "text": "Paseo de la Castellana 214, Madrid",
          "rows": [],
          "uncertainties": []
        },
        {
          "id": "p1-b010",
          "kind": "paragraph",
          "text": "Mantenimiento trimestral x1  ... 2.606,67 €",
          "rows": [],
          "uncertainties": []
        },
        {
          "id": "p1-b011",
          "kind": "paragraph",
          "text": "Transporte urgente x1  ... 1.075,77 €",
          "rows": [],
          "uncertainties": []
        },
        {
          "id": "p1-b012",
          "kind": "paragraph",
          "text": "Suministro pedido x1  ... 455,13 €",
          "rows": [],
          "uncertainties": []
        },
        {
          "id": "p1-b013",
          "kind": "paragraph",
          "text": "Base imponible: 4.137,57 €",
          "rows": [],
          "uncertainties": []
        },
        {
          "id": "p1-b014",
          "kind": "paragraph",
          "text": "IVA (21%): 868,89 €",
          "rows": [],
          "uncertainties": []
        },
        {
          "id": "p1-b015",
          "kind": "paragraph",
          "text": "TOTAL: 5.006,46 €",
          "rows": [],
          "uncertainties": []
        },
        {
          "id": "p1-b016",
          "kind": "footer",
          "text": "Documento generado por el sistema de facturacion del proveedor.",
          "rows": [],
          "uncertainties": []
        }
      ],
      "non_text_elements": []
    }
  ]
}
