{
  "schema_version": "0.1",
  "file_id": "scan_017.pdf",
  "capabilities": {
    "block_kinds": true,
    "tables": true,
    "layout": false
  },
  "pages": [
    {
      "page": 1,
      "blocks": [
        {
          "id": "p1-b001",
          "kind": "heading",
          "text": "Suministros Levante S.L.",
          "rows": [],
          "uncertainties": []
        },
        {
          "id": "p1-b002",
          "kind": "paragraph",
          "text": "NIF: B46102331  ·  Valencia",
          "rows": [],
          "uncertainties": [
            {
              "kind": "uncertain",
              "raw_text": "NIF: B46102331  ·  Valencia",
              "description": "Blur or smudge prevents certain reading; see structured issue."
            }
          ]
        },
        {
          "id": "p1-b003",
          "kind": "paragraph",
          "text": "Cuenta de abono (IBAN): ES21 0049 1500 0512 3456 7890",
          "rows": [],
          "uncertainties": [
            {
              "kind": "uncertain",
              "raw_text": "Cuenta de abono (IBAN): ES21 0049 1500 0512 3456 7890",
              "description": "Blur or smudge prevents certain reading; see structured issue."
            }
          ]
        },
        {
          "id": "p1-b004",
          "kind": "heading",
          "text": "FACTURA Nº FA-4102",
          "rows": [],
          "uncertainties": []
        },
        {
          "id": "p1-b005",
          "kind": "paragraph",
          "text": "Fecha: 04/03/2026",
          "rows": [],
          "uncertainties": [
            {
              "kind": "uncertain",
              "raw_text": "Fecha: 04/03/2026",
              "description": "Blur or smudge prevents certain reading; see structured issue."
            }
          ]
        },
        {
          "id": "p1-b006",
          "kind": "paragraph",
          "text": "Pedido: PO-2026-0717",
          "rows": [],
          "uncertainties": []
        },
        {
          "id": "p1-b007",
          "kind": "paragraph",
          "text": "Cliente: Banco Miralmar S.A.  ·  CIF: A58231074",
          "rows": [],
          "uncertainties": []
        },
        {
          "id": "p1-b008",
          "kind": "table",
          "text": "",
          "rows": [
            {
              "id": "p1-b008-r01",
              "cells": [
                {
                  "id": "p1-b008-r01-c1",
                  "column": 1,
                  "row_span": 1,
                  "column_span": 1,
                  "text": "Servicio mensual"
                },
                {
                  "id": "p1-b008-r01-c2",
                  "column": 2,
                  "row_span": 1,
                  "column_span": 1,
                  "text": "820,00"
                }
              ]
            },
            {
              "id": "p1-b008-r02",
              "cells": [
                {
                  "id": "p1-b008-r02-c1",
                  "column": 1,
                  "row_span": 1,
                  "column_span": 1,
                  "text": "Mantenimiento trimestral"
                },
                {
                  "id": "p1-b008-r02-c2",
                  "column": 2,
                  "row_span": 1,
                  "column_span": 1,
                  "text": "820,00"
                }
              ]
            }
          ],
          "uncertainties": []
        },
        {
          "id": "p1-b010",
          "kind": "paragraph",
          "text": "Base imponible  1.640,00",
          "rows": [],
          "uncertainties": []
        },
        {
          "id": "p1-b011",
          "kind": "paragraph",
          "text": "IVA 21%  344,40",
          "rows": [],
          "uncertainties": []
        },
        {
          "id": "p1-b012",
          "kind": "paragraph",
          "text": "TOTAL 1.984,40 EUR",
          "rows": [],
          "uncertainties": []
        },
        {
          "id": "p1-b013",
          "kind": "footer",
          "text": "Documento generado por el sistema de facturacion del proveedor.",
          "rows": [],
          "uncertainties": [
            {
              "kind": "uncertain",
              "raw_text": "Documento generado por el sistema de facturacion del proveedor.",
              "description": "Footer too blurred to verify every letter; tentative transcription only."
            }
          ]
        }
      ],
      "non_text_elements": [
        {
          "description": "Low resolution, blur, speckled background; gray oval smudges over NIF/location, bank number and total. Footer heavily blurred.",
          "reference_ids": []
        }
      ]
    }
  ]
}
