{
  "schema_version": "0.1",
  "file_id": "FA-4488_transportes.pdf",
  "capabilities": {
    "block_kinds": true,
    "tables": true,
    "layout": false
  },
  "pages": [
    {
      "page": 1,
      "blocks": [
        {
          "id": "p1-b001",
          "kind": "heading",
          "text": "Transportes Guadaira S.A.",
          "rows": [],
          "uncertainties": []
        },
        {
          "id": "p1-b002",
          "kind": "paragraph",
          "text": "NIF: A41220987",
          "rows": [],
          "uncertainties": []
        },
        {
          "id": "p1-b003",
          "kind": "paragraph",
          "text": "Sevilla · España",
          "rows": [],
          "uncertainties": []
        },
        {
          "id": "p1-b004",
          "kind": "paragraph",
          "text": "IBAN: ES76 2100 0813 6101 2345 6789",
          "rows": [],
          "uncertainties": []
        },
        {
          "id": "p1-b005",
          "kind": "heading",
          "text": "FACTURA Nº: FA-4488",
          "rows": [],
          "uncertainties": []
        },
        {
          "id": "p1-b006",
          "kind": "paragraph",
          "text": "Fecha: 08/04/2026",
          "rows": [],
          "uncertainties": []
        },
        {
          "id": "p1-b007",
          "kind": "paragraph",
          "text": "Ref. Pedido: PO-2026-1202",
          "rows": [],
          "uncertainties": []
        },
        {
          "id": "p1-b008",
          "kind": "paragraph",
          "text": "Cliente: Banco Miralmar S.A.  · CIF: A58231074",
          "rows": [],
          "uncertainties": []
        },
        {
          "id": "p1-b009",
          "kind": "paragraph",
          "text": "Paseo de la Castellana 214, Madrid",
          "rows": [],
          "uncertainties": []
        },
        {
          "id": "p1-b010",
          "kind": "paragraph",
          "text": "Servicio mensual x1  ... 726,67 €",
          "rows": [],
          "uncertainties": []
        },
        {
          "id": "p1-b011",
          "kind": "paragraph",
          "text": "Mantenimiento trimestral x1  ... 726,67 €",
          "rows": [],
          "uncertainties": []
        },
        {
          "id": "p1-b012",
          "kind": "paragraph",
          "text": "Suministro pedido x1  ... 726,66 €",
          "rows": [],
          "uncertainties": []
        },
        {
          "id": "p1-b013",
          "kind": "paragraph",
          "text": "Base imponible: 2.180,00 €",
          "rows": [],
          "uncertainties": []
        },
        {
          "id": "p1-b014",
          "kind": "paragraph",
          "text": "IVA (21%): 457,80 €",
          "rows": [],
          "uncertainties": []
        },
        {
          "id": "p1-b015",
          "kind": "paragraph",
          "text": "TOTAL: 2.637,80 €",
          "rows": [],
          "uncertainties": []
        },
        {
          "id": "p1-b016",
          "kind": "footer",
          "text": "Documento generado por el sistema de facturacion del proveedor.",
          "rows": [],
          "uncertainties": []
        }
      ],
      "non_text_elements": []
    }
  ]
}
