{
  "schema_version": "0.1",
  "file_id": "scan_023.pdf",
  "capabilities": {
    "block_kinds": true,
    "tables": true,
    "layout": false
  },
  "pages": [
    {
      "page": 1,
      "blocks": [
        {
          "id": "p1-b001",
          "kind": "heading",
          "text": "Catering Hermanos Pico S.L.",
          "rows": [],
          "uncertainties": []
        },
        {
          "id": "p1-b002",
          "kind": "paragraph",
          "text": "NIF: B96233419  ·  Valencia",
          "rows": [],
          "uncertainties": [
            {
              "kind": "uncertain",
              "raw_text": "NIF: B96233419  ·  Valencia",
              "description": "Blur or smudge prevents certain reading; see structured issue."
            }
          ]
        },
        {
          "id": "p1-b003",
          "kind": "paragraph",
          "text": "Cuenta de abono (IBAN): ES18 0081 5290 0700 0123 4567",
          "rows": [],
          "uncertainties": [
            {
              "kind": "uncertain",
              "raw_text": "Cuenta de abono (IBAN): ES18 0081 5290 0700 0123 4567",
              "description": "Blur or smudge prevents certain reading; see structured issue."
            }
          ]
        },
        {
          "id": "p1-b004",
          "kind": "heading",
          "text": "FACTURA Nº 2026/22608",
          "rows": [],
          "uncertainties": []
        },
        {
          "id": "p1-b005",
          "kind": "paragraph",
          "text": "Fecha: 29/04/2026",
          "rows": [],
          "uncertainties": []
        },
        {
          "id": "p1-b006",
          "kind": "paragraph",
          "text": "Pedido: PO-2026-0726",
          "rows": [],
          "uncertainties": []
        },
        {
          "id": "p1-b007",
          "kind": "paragraph",
          "text": "Cliente: Banco Miralmar S.A.  ·  CIF: A58231074",
          "rows": [],
          "uncertainties": []
        },
        {
          "id": "p1-b008",
          "kind": "table",
          "text": "",
          "rows": [
            {
              "id": "p1-b008-r01",
              "cells": [
                {
                  "id": "p1-b008-r01-c1",
                  "column": 1,
                  "row_span": 1,
                  "column_span": 1,
                  "text": "Servicio mensual"
                },
                {
                  "id": "p1-b008-r01-c2",
                  "column": 2,
                  "row_span": 1,
                  "column_span": 1,
                  "text": "683,33"
                }
              ]
            },
            {
              "id": "p1-b008-r02",
              "cells": [
                {
                  "id": "p1-b008-r02-c1",
                  "column": 1,
                  "row_span": 1,
                  "column_span": 1,
                  "text": "Mantenimiento trimestral"
                },
                {
                  "id": "p1-b008-r02-c2",
                  "column": 2,
                  "row_span": 1,
                  "column_span": 1,
                  "text": "683,33"
                }
              ]
            },
            {
              "id": "p1-b008-r03",
              "cells": [
                {
                  "id": "p1-b008-r03-c1",
                  "column": 1,
                  "row_span": 1,
                  "column_span": 1,
                  "text": "Suministro pedido"
                },
                {
                  "id": "p1-b008-r03-c2",
                  "column": 2,
                  "row_span": 1,
                  "column_span": 1,
                  "text": "683,34"
                }
              ]
            }
          ],
          "uncertainties": []
        },
        {
          "id": "p1-b011",
          "kind": "paragraph",
          "text": "Base imponible  2.050,00",
          "rows": [],
          "uncertainties": []
        },
        {
          "id": "p1-b012",
          "kind": "paragraph",
          "text": "IVA 21%  430,50",
          "rows": [],
          "uncertainties": []
        },
        {
          "id": "p1-b013",
          "kind": "paragraph",
          "text": "TOTAL 2.480,50 EUR",
          "rows": [],
          "uncertainties": []
        },
        {
          "id": "p1-b015",
          "kind": "note",
          "text": "OK",
          "rows": [],
          "uncertainties": []
        },
        {
          "id": "p1-b014",
          "kind": "footer",
          "text": "Documento generado por el sistema de facturacion del proveedor.",
          "rows": [],
          "uncertainties": [
            {
              "kind": "uncertain",
              "raw_text": "Documento generado por el sistema de facturacion del proveedor.",
              "description": "Footer too blurred to verify every letter; tentative transcription only."
            }
          ]
        },
        {
          "id": "p1-b016",
          "kind": "other",
          "text": "Informática Benimámet S.L.\nFACTURA Nº\nTOTAL",
          "rows": [],
          "uncertainties": [
            {
              "kind": "uncertain",
              "raw_text": "Informática Benimámet S.L.\nFACTURA Nº\nTOTAL",
              "description": "Faint mirrored bleed-through; tentative partial transcription, unreadable regions remain."
            }
          ]
        }
      ],
      "non_text_elements": [
        {
          "description": "Dark gray smudges over NIF/location, IBAN and total. Small OK mark above bank number. Faint mirrored second document at right, with largely unreadable fields and footer.",
          "reference_ids": []
        }
      ]
    }
  ]
}
