{
  "schema_version": "0.1",
  "file_id": "FA-4634_seguridad.pdf",
  "capabilities": {
    "block_kinds": true,
    "tables": true,
    "layout": false
  },
  "pages": [
    {
      "page": 1,
      "blocks": [
        {
          "id": "p1-b001",
          "kind": "heading",
          "text": "SEGURIDAD ALCORES S.L.",
          "rows": [],
          "uncertainties": []
        },
        {
          "id": "p1-b002",
          "kind": "paragraph",
          "text": "NIF B91455230  SEVILLA",
          "rows": [],
          "uncertainties": []
        },
        {
          "id": "p1-b003",
          "kind": "paragraph",
          "text": "CUENTA DE ABONO (IBAN): ES09 0073 0100 5105 0533 1902",
          "rows": [],
          "uncertainties": []
        },
        {
          "id": "p1-b004",
          "kind": "heading",
          "text": "REF FACTURA: FA-4634",
          "rows": [],
          "uncertainties": []
        },
        {
          "id": "p1-b005",
          "kind": "paragraph",
          "text": "FECHA: 26/05/2026",
          "rows": [],
          "uncertainties": []
        },
        {
          "id": "p1-b006",
          "kind": "paragraph",
          "text": "PEDIDO CLIENTE: PO-2026-0069",
          "rows": [],
          "uncertainties": []
        },
        {
          "id": "p1-b007",
          "kind": "paragraph",
          "text": "CLIENTE: BANCO MIRALMAR S.A.  CIF A58231074",
          "rows": [],
          "uncertainties": []
        },
        {
          "id": "p1-b008",
          "kind": "table",
          "text": "",
          "rows": [
            {
              "id": "p1-b008-r01",
              "cells": [
                {
                  "id": "p1-b008-r01-c1",
                  "column": 1,
                  "row_span": 1,
                  "column_span": 1,
                  "text": "INSTALACIÓN"
                },
                {
                  "id": "p1-b008-r01-c2",
                  "column": 2,
                  "row_span": 1,
                  "column_span": 1,
                  "text": "1.527,70"
                }
              ]
            },
            {
              "id": "p1-b008-r02",
              "cells": [
                {
                  "id": "p1-b008-r02-c1",
                  "column": 1,
                  "row_span": 1,
                  "column_span": 1,
                  "text": "REPARACIÓN EQUIPO"
                },
                {
                  "id": "p1-b008-r02-c2",
                  "column": 2,
                  "row_span": 1,
                  "column_span": 1,
                  "text": "84,87"
                }
              ]
            },
            {
              "id": "p1-b008-r03",
              "cells": [
                {
                  "id": "p1-b008-r03-c1",
                  "column": 1,
                  "row_span": 1,
                  "column_span": 1,
                  "text": "SUMINISTRO PEDIDO"
                },
                {
                  "id": "p1-b008-r03-c2",
                  "column": 2,
                  "row_span": 1,
                  "column_span": 1,
                  "text": "6.874,63"
                }
              ]
            }
          ],
          "uncertainties": []
        },
        {
          "id": "p1-b011",
          "kind": "paragraph",
          "text": "BASE IMPONIBLE....................      8.487,20",
          "rows": [],
          "uncertainties": []
        },
        {
          "id": "p1-b012",
          "kind": "paragraph",
          "text": "IVA (21%)..........................      1.782,31",
          "rows": [],
          "uncertainties": []
        },
        {
          "id": "p1-b013",
          "kind": "paragraph",
          "text": "TOTAL.............................     10.269,51",
          "rows": [],
          "uncertainties": []
        },
        {
          "id": "p1-b014",
          "kind": "footer",
          "text": "Documento generado por el sistema de facturacion del proveedor.",
          "rows": [],
          "uncertainties": []
        }
      ],
      "non_text_elements": []
    }
  ]
}
