{
  "schema_version": "0.1",
  "file_id": "scan_021.pdf",
  "capabilities": {
    "block_kinds": true,
    "tables": true,
    "layout": false
  },
  "pages": [
    {
      "page": 1,
      "blocks": [
        {
          "id": "p1-b001",
          "kind": "heading",
          "text": "Mensajería Rápida del Sur S.L.",
          "rows": [],
          "uncertainties": []
        },
        {
          "id": "p1-b002",
          "kind": "paragraph",
          "text": "NIF:   ·  Málaga",
          "rows": [],
          "uncertainties": [
            {
              "kind": "uncertain",
              "raw_text": "NIF:   ·  Málaga",
              "description": "Black scan band obscures NIF; do not reconstruct from another document."
            }
          ]
        },
        {
          "id": "p1-b003",
          "kind": "paragraph",
          "text": "Cuenta de abono (IBAN): ES93 6888 4400 1235 8890 0142",
          "rows": [],
          "uncertainties": []
        },
        {
          "id": "p1-b004",
          "kind": "heading",
          "text": "FACTURA Nº ",
          "rows": [],
          "uncertainties": [
            {
              "kind": "uncertain",
              "raw_text": "FACTURA Nº ",
              "description": "Invoice number covered by black band."
            }
          ]
        },
        {
          "id": "p1-b005",
          "kind": "paragraph",
          "text": "Fecha: 14/07/2026",
          "rows": [],
          "uncertainties": []
        },
        {
          "id": "p1-b006",
          "kind": "paragraph",
          "text": "Pedido: PO-2026-0723",
          "rows": [],
          "uncertainties": []
        },
        {
          "id": "p1-b007",
          "kind": "paragraph",
          "text": "Cliente: Banco Miralmar S.A.  ·  CIF: A58231074",
          "rows": [],
          "uncertainties": []
        },
        {
          "id": "p1-b008",
          "kind": "table",
          "text": "",
          "rows": [
            {
              "id": "p1-b008-r01",
              "cells": [
                {
                  "id": "p1-b008-r01-c1",
                  "column": 1,
                  "row_span": 1,
                  "column_span": 1,
                  "text": "Servicio mensual"
                },
                {
                  "id": "p1-b008-r01-c2",
                  "column": 2,
                  "row_span": 1,
                  "column_span": 1,
                  "text": "645,00"
                }
              ]
            },
            {
              "id": "p1-b008-r02",
              "cells": [
                {
                  "id": "p1-b008-r02-c1",
                  "column": 1,
                  "row_span": 1,
                  "column_span": 1,
                  "text": "Mantenimiento trimestral"
                },
                {
                  "id": "p1-b008-r02-c2",
                  "column": 2,
                  "row_span": 1,
                  "column_span": 1,
                  "text": "645,00"
                }
              ]
            }
          ],
          "uncertainties": []
        },
        {
          "id": "p1-b010",
          "kind": "paragraph",
          "text": "Base imponible  1.290,00",
          "rows": [],
          "uncertainties": []
        },
        {
          "id": "p1-b011",
          "kind": "paragraph",
          "text": "IVA 21%  270,90",
          "rows": [],
          "uncertainties": []
        },
        {
          "id": "p1-b012",
          "kind": "paragraph",
          "text": "TOTAL 1.560,90 EUR",
          "rows": [],
          "uncertainties": []
        },
        {
          "id": "p1-b013",
          "kind": "footer",
          "text": "Documento generado por el sistema de facturacion del proveedor.",
          "rows": [],
          "uncertainties": []
        }
      ],
      "non_text_elements": [
        {
          "description": "Dense black horizontal bands obscure NIF and invoice-number line. Small upper-edge marks, gray smudges behind bank number and total; footer faint but legible.",
          "reference_ids": []
        }
      ]
    }
  ]
}
